{
  "$schema": "https://json-schema.org/draft/2020-12/schema", "type": "object", "additionalProperties": false,
  "required": ["schemaVersion", "decisionId", "taskId", "candidateId", "candidateCommit", "checkpointSetSha256", "executionPlanSha256", "checkpointDecisions", "positioning", "resolvedRuleSet", "scope", "owner", "decision", "decidedAt"],
  "properties": {
    "schemaVersion": {"const": "4.0"}, "decisionId": {"type": "string"}, "taskId": {"type": "string"}, "candidateId": {"type": "string"},
    "candidateCommit": {"type": "string", "pattern": "^[0-9a-f]{40}$"}, "checkpointSetSha256": {"type": "string", "pattern": "^[0-9a-f]{64}$"}, "executionPlanSha256": {"type": "string", "pattern": "^[0-9a-f]{64}$"},
    "checkpointDecisions": {"type": "array", "items": {"type": "object", "additionalProperties": false, "required": ["checkpointId", "decision"], "properties": {"checkpointId": {"type": "string", "pattern": "^CP-[A-Z0-9][A-Z0-9._-]*$"}, "decision": {"enum": ["PASS", "REJECT"]}}}},
    "positioning": {"$ref": "#/$defs/ref"}, "resolvedRuleSet": {"$ref": "#/$defs/ref"}, "scope": {"type": "array", "minItems": 1, "items": {"type": "string"}},
    "owner": {"type": "object", "required": ["actorId"], "properties": {"actorId": {"type": "string", "minLength": 1}}}, "decision": {"const": "APPROVE"},
    "decidedAt": {"type": "string", "format": "date-time"}, "expiresAt": {"type": ["string", "null"], "format": "date-time"}, "keyId": {"type": "string"}, "signature": {"type": "object"}
  },
  "$defs": {"ref": {"type": "object", "additionalProperties": false, "required": ["path", "bytes", "sha256", "tracked"], "properties": {"path": {"type": "string"}, "bytes": {"type": "integer", "minimum": 0}, "sha256": {"type": "string", "pattern": "^[0-9a-f]{64}$"}, "tracked": {"const": true}}}}
}
